{
  "_meta": {
    "description": "Mock wallet data. Generated by an LLM (GLM-5.3) from the schema in data_gen/wallet_schema.json, then hand-edited for realism. Includes deliberate contact name duplicates and near-duplicates to exercise disambiguation.",
    "currency": "IQD"
  },
  "users": [
    { "id": "u1", "name": "سامر", "phone": "07701234567", "balance_iqd": 450000 }
  ],
  "contacts": [
    { "id": "c1",  "user_id": "u1", "name": "أحمد", "phone": "07701112233", "bank": "زين كاش" },
    { "id": "c2",  "user_id": "u1", "name": "أحمد علي", "phone": "07802224466", "bank": "آسيا حوالة" },
    { "id": "c3",  "user_id": "u1", "name": "أحمد حسين", "phone": "07501239988", "bank": "فاست باي" },
    { "id": "c4",  "user_id": "u1", "name": "علي حسين", "phone": "07712345678", "bank": "زين كاش" },
    { "id": "c5",  "user_id": "u1", "name": "حسين", "phone": "07819998877", "bank": "آسيا حوالة" },
    { "id": "c6",  "user_id": "u1", "name": "محمد الجبوري", "phone": "07705554433", "bank": "فاست باي" },
    { "id": "c7",  "user_id": "u1", "name": "زينب", "phone": "07501234599", "bank": "زين كاش" },
    { "id": "c8",  "user_id": "u1", "name": "مريم عبد الله", "phone": "07811223344", "bank": "آسيا حوالة" },
    { "id": "c9",  "user_id": "u1", "name": "عمر التميمي", "phone": "07709876543", "bank": "فاست باي" },
    { "id": "c10", "user_id": "u1", "name": "نور", "phone": "07706665544", "bank": "زين كاش" },
    { "id": "c11", "user_id": "u1", "name": "فاطمة", "phone": "07503332211", "bank": "آسيا حوالة" },
    { "id": "c12", "user_id": "u1", "name": "كرار", "phone": "07815556644", "bank": "فاست باي" },
    { "id": "c13", "user_id": "u1", "name": "علي", "phone": "07701119900", "bank": "زين كاش" },
    { "id": "c14", "user_id": "u1", "name": "د. ليلى", "phone": "07804443322", "bank": "آسيا حوالة" },
    { "id": "c15", "user_id": "u1", "name": "أبو سجاد (البقال)", "phone": "07701231230", "bank": "زين كاش" }
  ],
  "billers": [
    { "id": "b1", "name_ar": "كهرباء بغداد", "name_en": "Baghdad Electricity", "category": "كهرباء" },
    { "id": "b2", "name_ar": "ماء بغداد", "name_en": "Baghdad Water", "category": "ماء" },
    { "id": "b3", "name_ar": "إنترنت الفردوس", "name_en": "Al-Firdous Internet", "category": "انترنت" },
    { "id": "b4", "name_ar": "آسياسيل", "name_en": "Asiacell", "category": "موبايل" },
    { "id": "b5", "name_ar": "زين العراق", "name_en": "Zain Iraq", "category": "موبايل" },
    { "id": "b6", "name_ar": "كورك تيليكوم", "name_en": "Korek Telecom", "category": "موبايل" },
    { "id": "b7", "name_ar": "غاز المدينة", "name_en": "City Gas", "category": "غاز" }
  ],
  "user_billers": [
    { "user_id": "u1", "biller_id": "b1", "account_number": "527-8891", "last_amount_iqd": 35000 },
    { "user_id": "u1", "biller_id": "b2", "account_number": "44-1102", "last_amount_iqd": 8000 },
    { "user_id": "u1", "biller_id": "b3", "account_number": "FIS-3312", "last_amount_iqd": 30000 },
    { "user_id": "u1", "biller_id": "b4", "account_number": "07701234999", "last_amount_iqd": 15000 },
    { "user_id": "u1", "biller_id": "b5", "account_number": "07811220661", "last_amount_iqd": 20000 },
    { "user_id": "u1", "biller_id": "b6", "account_number": "07501188442", "last_amount_iqd": 10000 }
  ],
  "transactions": [
    { "id": "t01", "user_id": "u1", "type": "transfer", "counterparty": "أحمد", "amount_iqd": 25000, "status": "completed", "note": null, "created_at": "2026-09-18T10:03:00Z" },
    { "id": "t02", "user_id": "u1", "type": "bill_payment", "counterparty": "كهرباء بغداد", "amount_iqd": 35000, "status": "completed", "note": "حساب رقم 527-8891", "created_at": "2026-09-17T18:41:00Z" },
    { "id": "t03", "user_id": "u1", "type": "transfer", "counterparty": "زينب", "amount_iqd": 50000, "status": "completed", "note": "هدية", "created_at": "2026-09-15T14:22:00Z" },
    { "id": "t04", "user_id": "u1", "type": "bill_payment", "counterparty": "إنترنت الفردوس", "amount_iqd": 30000, "status": "completed", "note": "حساب رقم FIS-3312", "created_at": "2026-09-12T09:15:00Z" },
    { "id": "t05", "user_id": "u1", "type": "transfer", "counterparty": "محمد الجبوري", "amount_iqd": 100000, "status": "completed", "note": "سلفة", "created_at": "2026-09-10T20:05:00Z" },
    { "id": "t06", "user_id": "u1", "type": "bill_payment", "counterparty": "آسياسيل", "amount_iqd": 15000, "status": "completed", "note": "حساب رقم 07701234999", "created_at": "2026-09-08T08:00:00Z" }
  ]
}
